{
  "schema_version": "1.0.0",
  "task_id": "yurikuchumov-ux/ai-operating-system#18",
  "review_id": "manual-review-18-1",
  "reviewed_sha": "bbbbbbbbbbbbbbbbbbbbbbbbbbbbbbbbbbbbbbbb",
  "reviewer_identity": {
    "operator_principal": "human:independent-reviewer",
    "agent_runtime_id": "external:review-session:1",
    "credential_principal": "github:user:independent-reviewer",
    "delegation_parent": "owner:review-request-18",
    "role": "reviewer",
    "authored_commits": []
  },
  "eligibility": {
    "policy_id": "review-independence.v1",
    "risk_class": "L1",
    "overlap_results": [
      {
        "field": "agent_runtime_id",
        "overlap": false,
        "author_values": ["openai:codex:b0-session"],
        "reviewer_value": "external:review-session:1"
      }
    ],
    "eligible": true,
    "reason_codes": []
  },
  "reviewed_at": "2026-07-13T11:00:00Z"
}
