{
  "schema_version": "1.0.0",
  "task_id": "yurikuchumov-ux/ai-operating-system#52",
  "review_id": "external-gpt-review-issue-52-6ee5b22-1",
  "reviewed_sha": "6ee5b22bbf35ab1e377aca4b76c44c5af98ecff4",
  "reviewer_identity": {
    "operator_principal": "human:yurykuchumov",
    "agent_runtime_id": "openai:chatgpt:independent-review-session",
    "credential_principal": "openai:chatgpt:account:yurykuchumov",
    "delegation_parent": "owner:issue-52-review-request",
    "role": "reviewer",
    "authored_commits": []
  },
  "eligibility": {
    "policy_id": "review-independence.v1",
    "risk_class": "L2",
    "overlap_results": [
      {
        "field": "agent_runtime_id",
        "overlap": false,
        "author_values": [
          "claude-code:p0-executor-session"
        ],
        "reviewer_value": "openai:chatgpt:independent-review-session"
      },
      {
        "field": "credential_principal",
        "overlap": false,
        "author_values": [
          "github:actions:p0-executor"
        ],
        "reviewer_value": "openai:chatgpt:account:yurykuchumov"
      },
      {
        "field": "authored_commits",
        "overlap": false,
        "author_values": [
          "6ee5b22bbf35ab1e377aca4b76c44c5af98ecff4"
        ],
        "reviewer_value": "none"
      }
    ],
    "eligible": true,
    "reason_codes": []
  },
  "reviewed_at": "2026-07-18T09:36:52Z"
}
