{
  "schema_version": "1.0.0",
  "task_id": "yurikuchumov-ux/ai-operating-system#37",
  "review_id": "external-gpt-review-issue-37-2131a8b-2",
  "reviewed_sha": "2131a8b5d421c9c8624c10cd32a021484fc0f9ee",
  "reviewer_identity": {
    "operator_principal": "human:yurykuchumov",
    "agent_runtime_id": "openai:chatgpt:independent-review-session",
    "credential_principal": "openai:chatgpt:account:yurykuchumov",
    "delegation_parent": "owner:issue-37-review-request",
    "role": "reviewer",
    "authored_commits": []
  },
  "eligibility": {
    "policy_id": "review-independence.v1",
    "risk_class": "L2",
    "overlap_results": [
      {
        "field": "agent_runtime_id",
        "overlap": false,
        "author_values": [
          "anthropic:claude-code:0d291175-d38e-4ee1-9beb-f200fdc47271"
        ],
        "reviewer_value": "openai:chatgpt:independent-review-session"
      },
      {
        "field": "credential_principal",
        "overlap": false,
        "author_values": [
          "github:cli:yurikuchumov-ux"
        ],
        "reviewer_value": "openai:chatgpt:account:yurykuchumov"
      },
      {
        "field": "authored_commits",
        "overlap": false,
        "author_values": [
          "2131a8b5d421c9c8624c10cd32a021484fc0f9ee"
        ],
        "reviewer_value": "none"
      }
    ],
    "eligible": true,
    "reason_codes": []
  },
  "reviewed_at": "2026-07-17T07:43:50Z"
}
