{
  "schema_version": "1.0.0",
  "task_id": "yurikuchumov-ux/ai-operating-system#57",
  "review_id": "external-gpt-review-issue-57-4f04f039-1",
  "reviewed_sha": "4f04f039c7d28379f3165e8fe58f70d3d2b588d9",
  "reviewer_identity": {
    "operator_principal": "human:yurykuchumov",
    "agent_runtime_id": "openai:chatgpt:independent-review-session",
    "credential_principal": "openai:chatgpt:account:yurykuchumov",
    "delegation_parent": "owner:issue-57-bounded-review-request",
    "role": "reviewer",
    "authored_commits": []
  },
  "eligibility": {
    "policy_id": "review-independence.v1",
    "risk_class": "L2",
    "overlap_results": [
      {
        "field": "agent_runtime_id",
        "overlap": false,
        "author_values": [
          "openai:codex:019f55ba-98f5-70d2-833d-28fa75cc5658"
        ],
        "reviewer_value": "openai:chatgpt:independent-review-session"
      },
      {
        "field": "credential_principal",
        "overlap": false,
        "author_values": [
          "github:yurikuchumov-ux:local-git"
        ],
        "reviewer_value": "openai:chatgpt:account:yurykuchumov"
      },
      {
        "field": "authored_commits",
        "overlap": false,
        "author_values": [
          "4f04f039c7d28379f3165e8fe58f70d3d2b588d9"
        ],
        "reviewer_value": "none"
      }
    ],
    "eligible": true,
    "reason_codes": []
  },
  "reviewed_at": "2026-07-22T07:54:34Z"
}
