{
  "schema_version": "1.0.0",
  "task_id": "yurikuchumov-ux/ai-operating-system#27",
  "review_id": "external-gpt-review-issue-27-c491f124-1",
  "reviewed_sha": "c491f124a044d3753d3de7cf5e4360ceff217510",
  "reviewer_identity": {
    "operator_principal": "human:yurykuchumov",
    "agent_runtime_id": "openai:chatgpt:independent-review-session",
    "credential_principal": "openai:chatgpt:account:yurykuchumov",
    "delegation_parent": "owner:issue-27-review-request",
    "role": "reviewer",
    "authored_commits": []
  },
  "eligibility": {
    "policy_id": "review-independence.v1",
    "risk_class": "L2",
    "overlap_results": [
      {
        "field": "agent_runtime_id",
        "overlap": false,
        "author_values": [
          "claude-code:b3-session"
        ],
        "reviewer_value": "openai:chatgpt:independent-review-session"
      },
      {
        "field": "credential_principal",
        "overlap": false,
        "author_values": [
          "github:actions:b3-executor"
        ],
        "reviewer_value": "openai:chatgpt:account:yurykuchumov"
      },
      {
        "field": "authored_commits",
        "overlap": false,
        "author_values": [
          "06ac83545a596c30c46143b9744f9b0aa0c4410b",
          "76763b0d52025fc9f74094bb1223f66dec535d48",
          "84634c57222ca9bc0dbad35b42968124d4882273",
          "a7e4572f1f954741ba1f863fcc5c6a23a8dfdb9b",
          "c491f124a044d3753d3de7cf5e4360ceff217510",
          "e1dca06508d013e44d88c9b3101107e6a0a71d9f",
          "ffc3b8d1e6697c8afb22fb08a03428572fb9a783"
        ],
        "reviewer_value": "none"
      }
    ],
    "eligible": true,
    "reason_codes": []
  },
  "reviewed_at": "2026-07-15T18:30:00Z"
}
