{
  "schema_version": "1.0.0",
  "task_id": "yurikuchumov-ux/ai-operating-system#19",
  "review_id": "external-gpt-review-issue-19-84634c5-1",
  "reviewed_sha": "84634c57222ca9bc0dbad35b42968124d4882273",
  "reviewer_identity": {
    "operator_principal": "human:yurykuchumov",
    "agent_runtime_id": "openai:chatgpt:independent-review-session",
    "credential_principal": "openai:chatgpt:account:yurykuchumov",
    "delegation_parent": "owner:issue-19-review-request",
    "role": "reviewer",
    "authored_commits": []
  },
  "eligibility": {
    "policy_id": "review-independence.v1",
    "risk_class": "L2",
    "overlap_results": [
      {
        "field": "agent_runtime_id",
        "overlap": false,
        "author_values": [
          "claude-code:b3-session"
        ],
        "reviewer_value": "openai:chatgpt:independent-review-session"
      },
      {
        "field": "credential_principal",
        "overlap": false,
        "author_values": [
          "github:actions:b3-executor"
        ],
        "reviewer_value": "openai:chatgpt:account:yurykuchumov"
      },
      {
        "field": "authored_commits",
        "overlap": false,
        "author_values": [
          "76763b0d52025fc9f74094bb1223f66dec535d48",
          "e1dca06508d013e44d88c9b3101107e6a0a71d9f",
          "ffc3b8d1e6697c8afb22fb08a03428572fb9a783",
          "84634c57222ca9bc0dbad35b42968124d4882273"
        ],
        "reviewer_value": "none"
      }
    ],
    "eligible": true,
    "reason_codes": []
  },
  "reviewed_at": "2026-07-15T07:33:12Z"
}
