{
  "schema_version": "1.0.0",
  "task_id": "yurikuchumov-ux/ai-operating-system#65",
  "review_id": "independent-review-d4e455c825bd0a66f65432047fd1fb4e71d47e90",
  "reviewed_sha": "d4e455c825bd0a66f65432047fd1fb4e71d47e90",
  "reviewer_identity": {
    "operator_principal": "chatgpt-pro-session-user",
    "agent_runtime_id": "openai:gpt-5.6-pro",
    "credential_principal": "none",
    "delegation_parent": "none",
    "role": "reviewer",
    "authored_commits": []
  },
  "eligibility": {
    "policy_id": "review-independence.v1",
    "risk_class": "L2",
    "overlap_results": [
      {
        "field": "agent_runtime_id",
        "overlap": false,
        "author_values": [],
        "reviewer_value": "openai:gpt-5.6-pro"
      },
      {
        "field": "credential_principal",
        "overlap": false,
        "author_values": [],
        "reviewer_value": "none"
      },
      {
        "field": "authored_commits",
        "overlap": false,
        "author_values": [],
        "reviewer_value": "[]"
      }
    ],
    "eligible": true,
    "reason_codes": []
  },
  "reviewed_at": "2026-07-22T15:10:09Z"
}
