{
  "schema_version": "1.0.0",
  "task_id": "yurikuchumov-ux/ai-operating-system#57",
  "review_id": "external-gpt-pro-maximum-issue-57-pr64-1",
  "reviewed_sha": "8bf965ef66a326aaaaf96490332f42bde37442fb",
  "reviewer_identity": {
    "operator_principal": "human:yurykuchumov",
    "agent_runtime_id": "openai:chatgpt:pro-maximum-independent-review-session-v3",
    "credential_principal": "openai:chatgpt:account:yurykuchumov",
    "delegation_parent": "owner:issue-57-v9-review-request",
    "role": "reviewer",
    "authored_commits": []
  },
  "eligibility": {
    "policy_id": "review-independence.v1",
    "risk_class": "L2",
    "overlap_results": [
      {
        "field": "agent_runtime_id",
        "overlap": false,
        "author_values": [
          "claude-code:p0-executor-session"
        ],
        "reviewer_value": "openai:chatgpt:pro-maximum-independent-review-session-v3"
      },
      {
        "field": "credential_principal",
        "overlap": false,
        "author_values": [
          "github:actions:p0-executor"
        ],
        "reviewer_value": "openai:chatgpt:account:yurykuchumov"
      },
      {
        "field": "authored_commits",
        "overlap": false,
        "author_values": [
          "8bf965ef66a326aaaaf96490332f42bde37442fb"
        ],
        "reviewer_value": "none"
      }
    ],
    "eligible": true,
    "reason_codes": []
  },
  "reviewed_at": "2026-07-22T11:22:26Z"
}
