{
  "schema_version": "1.0.0",
  "task_id": "yurikuchumov-ux/ai-operating-system#20",
  "review_id": "self-review-20-1",
  "reviewed_sha": "a1b2c3d4e5f60718293a4b5c6d7e8f9012345678",
  "reviewer_identity": {
    "operator_principal": "github:yurikuchumov-ux",
    "agent_runtime_id": "claude-code:issue-20-session",
    "credential_principal": "github:actions:p0-executor",
    "delegation_parent": "issue-20-owner-decision",
    "role": "reviewer",
    "authored_commits": [
      "a1b2c3d4e5f60718293a4b5c6d7e8f9012345678"
    ]
  },
  "eligibility": {
    "policy_id": "review-independence.v1",
    "risk_class": "L2",
    "overlap_results": [
      {
        "field": "agent_runtime_id",
        "overlap": true,
        "author_values": ["claude-code:issue-20-session"],
        "reviewer_value": "claude-code:issue-20-session"
      },
      {
        "field": "credential_principal",
        "overlap": true,
        "author_values": ["github:actions:p0-executor"],
        "reviewer_value": "github:actions:p0-executor"
      }
    ],
    "eligible": false,
    "reason_codes": ["lineage_overlap"]
  },
  "reviewed_at": "2026-07-15T20:30:00Z"
}
