{
  "schema_version": "1.0.0",
  "task_id": "yurikuchumov-ux/ai-operating-system#35",
  "review_id": "external-gpt-review-issue-35-95bd968-1",
  "reviewed_sha": "95bd96811bb5474ad9cc6d3997756c840f59508b",
  "reviewer_identity": {
    "operator_principal": "human:yurykuchumov",
    "agent_runtime_id": "openai:chatgpt:independent-review-session",
    "credential_principal": "openai:chatgpt:account:yurykuchumov",
    "delegation_parent": "owner:issue-35-review-request",
    "role": "reviewer",
    "authored_commits": []
  },
  "eligibility": {
    "policy_id": "review-independence.v1",
    "risk_class": "L2",
    "overlap_results": [
      {
        "field": "agent_runtime_id",
        "overlap": false,
        "author_values": [
          "anthropic:claude-code:4b1c2420-9aab-40fb-8c6b-f131bc0467f3"
        ],
        "reviewer_value": "openai:chatgpt:independent-review-session"
      },
      {
        "field": "credential_principal",
        "overlap": false,
        "author_values": [
          "github:cli:yurikuchumov-ux"
        ],
        "reviewer_value": "openai:chatgpt:account:yurykuchumov"
      },
      {
        "field": "authored_commits",
        "overlap": false,
        "author_values": [
          "95bd96811bb5474ad9cc6d3997756c840f59508b"
        ],
        "reviewer_value": "none"
      }
    ],
    "eligible": true,
    "reason_codes": []
  },
  "reviewed_at": "2026-07-16T22:42:36Z"
}
